priority,tool,category,has_program,commission,recurring,cookie_days,network,status,signup_url,our_link,note
1,Higgsfield,video,yes,15% (Ambassador),12-month,30,Impact.com,active,https://higgsfield.ai/ambassador-program,https://go.agenticincome.ai/higgsfield,You use it — most authentic + highest ticket ($249/mo). JOIN FIRST. Separate Earn program = social posting.
2,Systeme.io,creator-stack,yes,60%,lifetime,,direct,active,https://systeme.io/affiliate-program,https://go.agenticincome.ai/systeme,Highest recurring % lifetime no gate. Compounding spine.
3,CapCut,creator-stack,yes,up to 35%,recurring,,Impact,active,https://www.capcut.com/partners/affiliate-program,https://go.agenticincome.ai/capcut,Massive install base easy convert.
4,ElevenLabs,creator-stack,yes,22% (11% Business),12-month,90,direct/PartnerStack,active,https://elevenlabs.io/affiliates,https://go.agenticincome.ai/elevenlabs,Long 90-day cookie + recurring + viral.
5,Copy.ai,writing,yes,45% first year,year-1,60,PartnerStack,active,https://www.copy.ai/partners,https://go.agenticincome.ai/copyai,Highest writing rate no traffic min.
6,Writesonic,writing,yes,30% (40% top),lifetime,30,PartnerStack/Tolt,active,https://writesonic.com/partners,https://go.agenticincome.ai/writesonic,Lifetime recurring.
7,Adobe Firefly,image,yes,~30%,recurring,60,Partnerize/Impact,active,https://www.adobe.com/affiliates.html,https://go.agenticincome.ai/firefly,Image-post monetization target (Midjourney/Ideogram/FLUX have none).
8,Jasper,writing,yes,up to 30%,year-1,,PartnerStack,deprioritized,https://www.jasper.ai/partners,https://go.agenticincome.ai/jasper,Deprioritized 2026-06-07 — Frank not a fan, not a brand fit. Skip unless reconsidered.
7,Gamma,content-creation,yes,~,recurring,,PartnerStack,active,https://gamma.app/partners,https://go.agenticincome.ai/gamma,Priority. AI presentation maker — the pick in best-ai-presentation-maker + ultimate-gamma-workflow posts. Verify commission on PartnerStack.
5,HeyGen,video,yes,~20%,12-month,60,direct/Partnerstack,active,https://www.heygen.com/affiliate,https://go.agenticincome.ai/heygen,AI avatar leader — recommended across faceless-youtube + heygen-vs-synthesia posts. ~20% recurring 12mo, 60-day cookie.
9,Synthesia,video,yes,~25% first year,year-1,60,direct,active,https://www.synthesia.io/affiliates,https://go.agenticincome.ai/synthesia,Enterprise AI avatar — heygen-vs-synthesia post. ~25% of first-year payments, 60-day cookie; rewards free custom avatar at referral milestones.
6,Opus Clip,video,yes,~,recurring,,direct,active,https://www.opus.pro/affiliate,https://go.agenticincome.ai/opus,Long→short repurposing — faceless-youtube stack. Verify current commission.
9,Topaz Labs,video,yes,20%,one-time,30,direct,active,https://topazlabs.com/affiliates/,https://go.agenticincome.ai/topaz,High one-time AOV. Strong AI-upscaling SEO intent.
10,Pika,video,yes,30%,recurring,,direct,verify,https://pika.art,https://go.agenticincome.ai/pika,Fills Runway/Luma gap. VERIFY pika.art vs pika.style.
11,Freepik,image,yes,30% recurring/20% one-time,recurring,,multiple,active,https://www.freepik.com/affiliates,https://go.agenticincome.ai/freepik,Rate depends on network.
12,Canva,image,yes,up to $36/signup,one-time,,Impact,active,https://www.canva.com/affiliates/,https://go.agenticincome.ai/canva,High convert low capped ticket.
13,Descript,creator-stack,yes,15% (or $25/sale),12-month,,PartnerStack,active,https://www.descript.com/affiliate,https://go.agenticincome.ai/descript,Initial term only no renewals.
14,Perplexity,llm,yes,~$15/US referral,one-time,,Dub Partners,active,https://partners.dub.co/perplexity,https://go.agenticincome.ai/perplexity,The ONE frontier-adjacent LLM program. US converts best.
15,Rytr,writing,yes,30%,lifetime,,direct,active,https://rytr.me/affiliates,https://go.agenticincome.ai/rytr,Low ticket truly recurring.
16,Pollo AI,video,yes,n/c,n/c,,direct,active,https://pollo.ai/affiliate-program,https://go.agenticincome.ai/pollo,Aggregator backdoor for Seedance/Veo/Sora/Kling.
-,OpenAI,llm,no,,,,,dead-end,,,No program. Capture traffic route to payers.
-,Anthropic,llm,no,,,,,dead-end,,,No program (Claude/Claude Code).
-,Google,llm,no,,,,,dead-end,,,No program (Gemini/Veo/Nano Banana).
-,Runway,video,no,,,,,dead-end,,,No program. Route to Higgsfield/Pika/Topaz.
-,Luma,video,no,,,,,dead-end,,,No program.
-,Kling,video,no,,,,,dead-end,,,No direct program — use Pollo.
-,Midjourney,image,no,,,,,dead-end,,,Never had a program.
-,Ideogram,image,no,,,,,dead-end,,,No program. Route to Firefly/Canva/Freepik.
-,Recraft,image,no,,,,,dead-end,,,No program.
-,Black Forest Labs,image,no,,,,,dead-end,,,Model lab — no referral layer.
-,Leonardo.ai,image,no,,,,Impact,closed,,,CLOSED Apr 7 2026 — no new applicants.
-,Notion,creator-stack,no,50%/180d (when open),lifetime,180,direct,closed,,,Not accepting new affiliates (Mar 2026). Monitor.
